    1   0.000000    10.0.2.15 → 99.84.106.150 TLSv1.2 85 Encrypted Alert
    2   0.000416 99.84.106.150 → 10.0.2.15    TCP 60 443 → 54591 [ACK] Seq=1 Ack=32 Win=65535 Len=0
    3   0.001042    10.0.2.15 → 172.217.5.234 TLSv1.2 85 Encrypted Alert
    4   0.001208    10.0.2.15 → 172.217.5.234 TCP 54 44207 → 443 [FIN, ACK] Seq=32 Ack=1 Win=48212 Len=0
    5   0.001287 172.217.5.234 → 10.0.2.15    TCP 60 443 → 44207 [ACK] Seq=1 Ack=32 Win=65535 Len=0
    6   0.001638 172.217.5.234 → 10.0.2.15    TCP 60 443 → 44207 [ACK] Seq=1 Ack=33 Win=65535 Len=0
    7   0.002520    10.0.2.15 → 99.84.106.150 TCP 54 54591 → 443 [FIN, ACK] Seq=32 Ack=1 Win=65535 Len=0
    8   0.002816 99.84.106.150 → 10.0.2.15    TCP 60 443 → 54591 [ACK] Seq=1 Ack=33 Win=65535 Len=0
    9   0.004407 99.84.106.150 → 10.0.2.15    TCP 60 443 → 54591 [FIN, ACK] Seq=1 Ack=33 Win=65535 Len=0
   10   0.004427    10.0.2.15 → 99.84.106.150 TCP 54 54591 → 443 [ACK] Seq=33 Ack=2 Win=33156 Len=0
   11   0.007576 172.217.5.234 → 10.0.2.15    TCP 60 443 → 44207 [FIN, ACK] Seq=1 Ack=33 Win=65535 Len=0
   12   0.007590    10.0.2.15 → 172.217.5.234 TCP 54 44207 → 443 [ACK] Seq=33 Ack=2 Win=48212 Len=0
   13   0.999736    10.0.2.15 → 172.217.164.174 TLSv1.2 85 Encrypted Alert
   14   1.000081 172.217.164.174 → 10.0.2.15    TCP 60 443 → 39883 [ACK] Seq=1 Ack=32 Win=65535 Len=0
   15   1.000124    10.0.2.15 → 172.217.164.174 TCP 54 39883 → 443 [FIN, ACK] Seq=32 Ack=1 Win=65320 Len=0
   16   1.000351 172.217.164.174 → 10.0.2.15    TCP 60 443 → 39883 [ACK] Seq=1 Ack=33 Win=65535 Len=0
   17   1.003494 172.217.164.174 → 10.0.2.15    TCP 60 443 → 39883 [FIN, ACK] Seq=1 Ack=33 Win=65535 Len=0
   18   1.003509    10.0.2.15 → 172.217.164.174 TCP 54 39883 → 443 [ACK] Seq=33 Ack=2 Win=65320 Len=0
   19   1.999525    10.0.2.15 → 74.125.192.154 TLSv1.2 85 Encrypted Alert
   20   1.999752    10.0.2.15 → 74.125.192.154 TCP 54 49393 → 443 [FIN, ACK] Seq=32 Ack=1 Win=39704 Len=0
   21   2.000015 74.125.192.154 → 10.0.2.15    TCP 60 443 → 49393 [ACK] Seq=1 Ack=32 Win=65535 Len=0
   22   2.000027 74.125.192.154 → 10.0.2.15    TCP 60 443 → 49393 [ACK] Seq=1 Ack=33 Win=65535 Len=0
   23   2.011056 74.125.192.154 → 10.0.2.15    TCP 60 443 → 49393 [FIN, ACK] Seq=1 Ack=33 Win=65535 Len=0
   24   2.011071    10.0.2.15 → 74.125.192.154 TCP 54 49393 → 443 [ACK] Seq=33 Ack=2 Win=39704 Len=0
   25  23.640985    10.0.2.15 → 10.0.2.3     DNS 85 Standard query 0x5781 A www.google.com OPT
   26  23.642904    10.0.2.15 → 10.0.2.3     DNS 85 Standard query 0x694b AAAA www.google.com OPT
   27  23.658438     10.0.2.3 → 10.0.2.15    DNS 349 Standard query response 0x5781 A www.google.com A 172.217.7.164 NS ns4.google.com NS ns2.google.com NS ns1.google.com NS ns3.google.com A 216.239.34.10 AAAA 2001:4860:4802:34::a A 216.239.32.10 AAAA 2001:4860:4802:32::a A 216.239.36.10 AAAA 2001:4860:4802:36::a A 216.239.38.10 AAAA 2001:4860:4802:38::a OPT
   28  23.659795     10.0.2.3 → 10.0.2.15    DNS 361 Standard query response 0x694b AAAA www.google.com AAAA 2607:f8b0:4004:800::2004 NS ns1.google.com NS ns2.google.com NS ns4.google.com NS ns3.google.com A 216.239.34.10 AAAA 2001:4860:4802:34::a A 216.239.32.10 AAAA 2001:4860:4802:32::a A 216.239.36.10 AAAA 2001:4860:4802:36::a A 216.239.38.10 AAAA 2001:4860:4802:38::a OPT
   29  23.660249    10.0.2.15 → 172.217.7.164 TCP 74 56269 → 443 [SYN] Seq=0 Win=29200 Len=0 MSS=1460 SACK_PERM=1 TSval=1621007646 TSecr=0 WS=128
   30  23.664884 172.217.7.164 → 10.0.2.15    TCP 60 443 → 56269 [SYN, ACK] Seq=0 Ack=1 Win=65535 Len=0 MSS=1460
   31  23.664907    10.0.2.15 → 172.217.7.164 TCP 54 56269 → 443 [ACK] Seq=1 Ack=1 Win=29200 Len=0
   32  23.675550    10.0.2.15 → 172.217.7.164 TLSv1 241 Client Hello
   33  23.675782 172.217.7.164 → 10.0.2.15    TCP 60 443 → 56269 [ACK] Seq=1 Ack=188 Win=65535 Len=0
   34  23.688880 172.217.7.164 → 10.0.2.15    TLSv1.2 2377 Server Hello, Certificate, Server Key Exchange, Server Hello Done
   35  23.688900    10.0.2.15 → 172.217.7.164 TCP 54 56269 → 443 [ACK] Seq=188 Ack=2324 Win=32660 Len=0
   36  23.690964    10.0.2.15 → 172.217.7.164 TLSv1.2 147 Client Key Exchange, Change Cipher Spec, Finished
   37  23.691161 172.217.7.164 → 10.0.2.15    TCP 60 443 → 56269 [ACK] Seq=2324 Ack=281 Win=65535 Len=0
   38  23.696676 172.217.7.164 → 10.0.2.15    TLSv1.2 338 New Session Ticket, Change Cipher Spec, Finished
   39  23.720161    10.0.2.15 → 172.217.7.164 HTTP2 158 Magic, SETTINGS[0]
   40  23.720487 172.217.7.164 → 10.0.2.15    TCP 60 443 → 56269 [ACK] Seq=2608 Ack=385 Win=65535 Len=0
   41  23.721680    10.0.2.15 → 172.217.7.164 HTTP2 110 SETTINGS[0]
   42  23.721870 172.217.7.164 → 10.0.2.15    TCP 60 443 → 56269 [ACK] Seq=2608 Ack=441 Win=65535 Len=0
   43  23.724533 172.217.7.164 → 10.0.2.15    HTTP2 123 SETTINGS[0], WINDOW_UPDATE[0]
   44  23.724540 172.217.7.164 → 10.0.2.15    HTTP2 92 SETTINGS[0]
   45  23.728111 172.217.7.164 → 10.0.2.15    HTTP2 92 SETTINGS[0]
   46  23.735004    10.0.2.15 → 172.217.7.164 HTTP2 92 SETTINGS[0]
   47  23.735253 172.217.7.164 → 10.0.2.15    TCP 60 443 → 56269 [ACK] Seq=2753 Ack=479 Win=65535 Len=0
   48  23.849009    10.0.2.15 → 172.217.7.164 HTTP2 239 HEADERS[1]: GET /complete/search?client=firefox&q=cs
   49  23.849256 172.217.7.164 → 10.0.2.15    TCP 60 443 → 56269 [ACK] Seq=2753 Ack=664 Win=65535 Len=0
   50  23.881256 172.217.7.164 → 10.0.2.15    HTTP2 473 DATA[1]
   51  23.883740 172.217.7.164 → 10.0.2.15    HTTP2 177 PING[0]
   52  23.890982    10.0.2.15 → 172.217.7.164 TCP 54 56269 → 443 [ACK] Seq=664 Ack=3295 Win=38340 Len=0
   53  23.894915    10.0.2.15 → 172.217.7.164 HTTP2 100 PING[0]
   54  23.895190 172.217.7.164 → 10.0.2.15    TCP 60 443 → 56269 [ACK] Seq=3295 Ack=710 Win=65535 Len=0
   55  28.156555    10.0.2.15 → 10.0.2.3     DNS 84 Standard query 0x0ec8 A csee.umbc.edu OPT
   56  28.156913    10.0.2.15 → 10.0.2.3     DNS 84 Standard query 0xcf29 AAAA csee.umbc.edu OPT
   57  28.157787     10.0.2.3 → 10.0.2.15    DNS 312 Standard query response 0x0ec8 A csee.umbc.edu A 130.85.36.80 NS dnsexternal1.umbc.edu NS dnsexternal2.umbc.edu NS dnsexternal.umbc.edu A 130.85.1.6 AAAA 2620:0:5301:2::2:1 A 130.85.1.11 AAAA 2620:0:5301:2::2:3 A 130.85.1.9 AAAA 2620:0:5301:2::2:2 OPT
   58  28.158291     10.0.2.3 → 10.0.2.15    DNS 138 Standard query response 0xcf29 AAAA csee.umbc.edu SOA UMBC10.umbc.edu OPT
   59  28.158611    10.0.2.15 → 130.85.36.80 TCP 74 39021 → 80 [SYN] Seq=0 Win=29200 Len=0 MSS=1460 SACK_PERM=1 TSval=2350241127 TSecr=0 WS=128
   60  28.159451 130.85.36.80 → 10.0.2.15    TCP 60 80 → 39021 [SYN, ACK] Seq=0 Ack=1 Win=65535 Len=0 MSS=1460
   61  28.159477    10.0.2.15 → 130.85.36.80 TCP 54 39021 → 80 [ACK] Seq=1 Ack=1 Win=29200 Len=0
   62  28.165223    10.0.2.15 → 130.85.36.80 HTTP 495 GET / HTTP/1.1 
   63  28.165483 130.85.36.80 → 10.0.2.15    TCP 60 80 → 39021 [ACK] Seq=1 Ack=442 Win=65535 Len=0
   64  28.166358 130.85.36.80 → 10.0.2.15    HTTP 599 HTTP/1.1 301 Moved Permanently  (text/html)
   65  28.166368    10.0.2.15 → 130.85.36.80 TCP 54 39021 → 80 [ACK] Seq=442 Ack=546 Win=29975 Len=0
   66  28.216676    10.0.2.15 → 130.85.36.80 TCP 54 39021 → 80 [FIN, ACK] Seq=442 Ack=546 Win=29975 Len=0
   67  28.217044 130.85.36.80 → 10.0.2.15    TCP 60 80 → 39021 [ACK] Seq=546 Ack=443 Win=65535 Len=0
   68  28.217277 130.85.36.80 → 10.0.2.15    TCP 60 80 → 39021 [FIN, ACK] Seq=546 Ack=443 Win=65535 Len=0
   69  28.217288    10.0.2.15 → 130.85.36.80 TCP 54 39021 → 80 [ACK] Seq=443 Ack=547 Win=29975 Len=0
   70  28.231692    10.0.2.15 → 10.0.2.3     DNS 88 Standard query 0x82ad A www.csee.umbc.edu OPT
   71  28.231978    10.0.2.15 → 10.0.2.3     DNS 88 Standard query 0x7b92 AAAA www.csee.umbc.edu OPT
   72  28.233302     10.0.2.3 → 10.0.2.15    DNS 316 Standard query response 0x82ad A www.csee.umbc.edu A 130.85.36.80 NS dnsexternal1.umbc.edu NS dnsexternal2.umbc.edu NS dnsexternal.umbc.edu A 130.85.1.11 AAAA 2620:0:5301:2::2:3 A 130.85.1.9 AAAA 2620:0:5301:2::2:2 A 130.85.1.6 AAAA 2620:0:5301:2::2:1 OPT
   73  28.236880     10.0.2.3 → 10.0.2.15    DNS 142 Standard query response 0x7b92 AAAA www.csee.umbc.edu SOA UMBC10.umbc.edu OPT
   74  28.237119    10.0.2.15 → 130.85.36.80 TCP 74 51317 → 80 [SYN] Seq=0 Win=29200 Len=0 MSS=1460 SACK_PERM=1 TSval=2350241205 TSecr=0 WS=128
   75  28.237577 130.85.36.80 → 10.0.2.15    TCP 60 80 → 51317 [SYN, ACK] Seq=0 Ack=1 Win=65535 Len=0 MSS=1460
   76  28.237599    10.0.2.15 → 130.85.36.80 TCP 54 51317 → 80 [ACK] Seq=1 Ack=1 Win=29200 Len=0
   77  28.237859    10.0.2.15 → 130.85.36.80 HTTP 499 GET / HTTP/1.1 
   78  28.238082 130.85.36.80 → 10.0.2.15    TCP 60 80 → 51317 [ACK] Seq=1 Ack=446 Win=65535 Len=0
   79  28.241947 130.85.36.80 → 10.0.2.15    HTTP 601 HTTP/1.1 301 Moved Permanently  (text/html)
   80  28.241957    10.0.2.15 → 130.85.36.80 TCP 54 51317 → 80 [ACK] Seq=446 Ack=548 Win=30085 Len=0
   81  28.340982    10.0.2.15 → 130.85.36.80 TCP 74 57929 → 443 [SYN] Seq=0 Win=29200 Len=0 MSS=1460 SACK_PERM=1 TSval=2350241309 TSecr=0 WS=128
   82  28.341612 130.85.36.80 → 10.0.2.15    TCP 60 443 → 57929 [SYN, ACK] Seq=0 Ack=1 Win=65535 Len=0 MSS=1460
   83  28.341636    10.0.2.15 → 130.85.36.80 TCP 54 57929 → 443 [ACK] Seq=1 Ack=1 Win=29200 Len=0
   84  28.354725    10.0.2.15 → 130.85.36.80 TLSv1 244 Client Hello
   85  28.355004 130.85.36.80 → 10.0.2.15    TCP 60 443 → 57929 [ACK] Seq=1 Ack=191 Win=65535 Len=0
   86  28.356042 130.85.36.80 → 10.0.2.15    TLSv1.2 2894 Server Hello
   87  28.356054    10.0.2.15 → 130.85.36.80 TCP 54 57929 → 443 [ACK] Seq=191 Ack=2841 Win=34080 Len=0
   88  28.356234 130.85.36.80 → 10.0.2.15    TCP 1310 443 → 57929 [PSH, ACK] Seq=2841 Ack=191 Win=65535 Len=1256 [TCP segment of a reassembled PDU]
   89  28.356245    10.0.2.15 → 130.85.36.80 TCP 54 57929 → 443 [ACK] Seq=191 Ack=4097 Win=36920 Len=0
   90  28.361682 130.85.36.80 → 10.0.2.15    TLSv1.2 1502 Certificate [TCP segment of a reassembled PDU]
   91  28.361715    10.0.2.15 → 130.85.36.80 TCP 54 57929 → 443 [ACK] Seq=191 Ack=5545 Win=39760 Len=0
   92  28.361768 130.85.36.80 → 10.0.2.15    TLSv1.2 397 Server Key Exchange, Server Hello Done
   93  28.361774    10.0.2.15 → 130.85.36.80 TCP 54 57929 → 443 [ACK] Seq=191 Ack=5888 Win=42600 Len=0
   94  28.368185    10.0.2.15 → 130.85.36.80 TLSv1.2 180 Client Key Exchange, Change Cipher Spec, Finished
   95  28.368820 130.85.36.80 → 10.0.2.15    TCP 60 443 → 57929 [ACK] Seq=5888 Ack=317 Win=65535 Len=0
   96  28.369345 130.85.36.80 → 10.0.2.15    TLSv1.2 328 New Session Ticket, Change Cipher Spec, Finished
   97  28.416896    10.0.2.15 → 130.85.36.80 TCP 54 57929 → 443 [ACK] Seq=317 Ack=6162 Win=45440 Len=0
   98  28.417514    10.0.2.15 → 130.85.36.80 HTTP 532 GET / HTTP/1.1 
   99  28.417816 130.85.36.80 → 10.0.2.15    TCP 60 443 → 57929 [ACK] Seq=6162 Ack=795 Win=65535 Len=0
  100  28.663044 08:00:27:db:11:88 → 52:54:00:12:35:03 ARP 42 Who has 10.0.2.3? Tell 10.0.2.15
  101  28.663472 52:54:00:12:35:03 → 08:00:27:db:11:88 ARP 60 10.0.2.3 is at 52:54:00:12:35:03
  102  29.489366 130.85.36.80 → 10.0.2.15    TLSv1.2 8802 [SSL segment of a reassembled PDU]
  103  29.489405    10.0.2.15 → 130.85.36.80 TCP 54 57929 → 443 [ACK] Seq=795 Ack=14910 Win=62480 Len=0
  104  29.489629 130.85.36.80 → 10.0.2.15    HTTP 3810 HTTP/1.1 200 OK  (text/html)
  105  29.489642    10.0.2.15 → 130.85.36.80 TCP 54 57929 → 443 [ACK] Seq=795 Ack=18666 Win=65320 Len=0
  106  29.776253    10.0.2.15 → 130.85.36.80 HTTP 556 GET /wp-includes/css/dist/block-library/style.min.css?ver=5.1.1 HTTP/1.1 
  107  29.776599 130.85.36.80 → 10.0.2.15    TCP 60 443 → 57929 [ACK] Seq=18666 Ack=1297 Win=65535 Len=0
  108  29.781851 130.85.36.80 → 10.0.2.15    HTTP 5017 HTTP/1.1 200 OK  (text/css)
  109  29.781866    10.0.2.15 → 130.85.36.80 TCP 54 57929 → 443 [ACK] Seq=1297 Ack=23629 Win=65320 Len=0
  110  29.936500    10.0.2.15 → 130.85.36.80 HTTP 550 GET /wp-content/uploads/master-slider/custom.css?ver=76.7 HTTP/1.1 
  111  29.936929 130.85.36.80 → 10.0.2.15    TCP 60 443 → 57929 [ACK] Seq=23629 Ack=1793 Win=65535 Len=0
  112  29.940817 130.85.36.80 → 10.0.2.15    HTTP 868 HTTP/1.1 200 OK  (text/css)
  113  29.940831    10.0.2.15 → 130.85.36.80 TCP 54 57929 → 443 [ACK] Seq=1793 Ack=24443 Win=65320 Len=0
  114  29.965604    10.0.2.15 → 130.85.36.80 TCP 74 45811 → 443 [SYN] Seq=0 Win=29200 Len=0 MSS=1460 SACK_PERM=1 TSval=2350242934 TSecr=0 WS=128
  115  29.965965    10.0.2.15 → 130.85.36.80 TCP 74 46509 → 443 [SYN] Seq=0 Win=29200 Len=0 MSS=1460 SACK_PERM=1 TSval=2350242934 TSecr=0 WS=128
  116  29.966435 130.85.36.80 → 10.0.2.15    TCP 60 443 → 45811 [SYN, ACK] Seq=0 Ack=1 Win=65535 Len=0 MSS=1460
  117  29.966465    10.0.2.15 → 130.85.36.80 TCP 54 45811 → 443 [ACK] Seq=1 Ack=1 Win=29200 Len=0
  118  29.966513 130.85.36.80 → 10.0.2.15    TCP 60 443 → 46509 [SYN, ACK] Seq=0 Ack=1 Win=65535 Len=0 MSS=1460
  119  29.966526    10.0.2.15 → 130.85.36.80 TCP 54 46509 → 443 [ACK] Seq=1 Ack=1 Win=29200 Len=0
  120  29.991084    10.0.2.15 → 130.85.36.80 TCP 74 50533 → 443 [SYN] Seq=0 Win=29200 Len=0 MSS=1460 SACK_PERM=1 TSval=2350242959 TSecr=0 WS=128
  121  29.991734 130.85.36.80 → 10.0.2.15    TCP 60 443 → 50533 [SYN, ACK] Seq=0 Ack=1 Win=65535 Len=0 MSS=1460
  122  29.991767    10.0.2.15 → 130.85.36.80 TCP 54 50533 → 443 [ACK] Seq=1 Ack=1 Win=29200 Len=0
  123  30.041308    10.0.2.15 → 130.85.36.80 TLSv1 244 Client Hello
  124  30.041613 130.85.36.80 → 10.0.2.15    TCP 60 443 → 50533 [ACK] Seq=1 Ack=191 Win=65535 Len=0
  125  30.045489 130.85.36.80 → 10.0.2.15    TLSv1.2 2894 Server Hello
  126  30.045501    10.0.2.15 → 130.85.36.80 TCP 54 50533 → 443 [ACK] Seq=191 Ack=2841 Win=34080 Len=0
  127  30.045696 130.85.36.80 → 10.0.2.15    TCP 1310 443 → 50533 [PSH, ACK] Seq=2841 Ack=191 Win=65535 Len=1256 [TCP segment of a reassembled PDU]
  128  30.045708    10.0.2.15 → 130.85.36.80 TCP 54 50533 → 443 [ACK] Seq=191 Ack=4097 Win=36920 Len=0
  129  30.053102 130.85.36.80 → 10.0.2.15    TLSv1.2 1502 Certificate [TCP segment of a reassembled PDU]
  130  30.053128    10.0.2.15 → 130.85.36.80 TCP 54 50533 → 443 [ACK] Seq=191 Ack=5545 Win=39760 Len=0
  131  30.053178 130.85.36.80 → 10.0.2.15    TLSv1.2 397 Server Key Exchange, Server Hello Done
  132  30.053186    10.0.2.15 → 130.85.36.80 TCP 54 50533 → 443 [ACK] Seq=191 Ack=5888 Win=42600 Len=0
  133  30.061935    10.0.2.15 → 130.85.36.80 TLSv1 244 Client Hello
  134  30.062236 130.85.36.80 → 10.0.2.15    TCP 60 443 → 45811 [ACK] Seq=1 Ack=191 Win=65535 Len=0
  135  30.064655    10.0.2.15 → 130.85.36.80 TCP 74 40117 → 443 [SYN] Seq=0 Win=29200 Len=0 MSS=1460 SACK_PERM=1 TSval=2350243033 TSecr=0 WS=128
  136  30.065182    10.0.2.15 → 130.85.36.80 TLSv1 244 Client Hello
  137  30.065267 130.85.36.80 → 10.0.2.15    TCP 60 443 → 40117 [SYN, ACK] Seq=0 Ack=1 Win=65535 Len=0 MSS=1460
  138  30.065296    10.0.2.15 → 130.85.36.80 TCP 54 40117 → 443 [ACK] Seq=1 Ack=1 Win=29200 Len=0
  139  30.065580 130.85.36.80 → 10.0.2.15    TCP 60 443 → 46509 [ACK] Seq=1 Ack=191 Win=65535 Len=0
  140  30.066057 130.85.36.80 → 10.0.2.15    TLSv1.2 2894 Server Hello
  141  30.066068    10.0.2.15 → 130.85.36.80 TCP 54 45811 → 443 [ACK] Seq=191 Ack=2841 Win=34080 Len=0
  142  30.066365 130.85.36.80 → 10.0.2.15    TCP 1310 443 → 45811 [PSH, ACK] Seq=2841 Ack=191 Win=65535 Len=1256 [TCP segment of a reassembled PDU]
  143  30.066378    10.0.2.15 → 130.85.36.80 TCP 54 45811 → 443 [ACK] Seq=191 Ack=4097 Win=36920 Len=0
  144  30.066438 130.85.36.80 → 10.0.2.15    TLSv1.2 2894 Server Hello
  145  30.066449    10.0.2.15 → 130.85.36.80 TCP 54 46509 → 443 [ACK] Seq=191 Ack=2841 Win=34080 Len=0
  146  30.066653 130.85.36.80 → 10.0.2.15    TCP 1310 443 → 46509 [PSH, ACK] Seq=2841 Ack=191 Win=65535 Len=1256 [TCP segment of a reassembled PDU]
  147  30.066663    10.0.2.15 → 130.85.36.80 TCP 54 46509 → 443 [ACK] Seq=191 Ack=4097 Win=36920 Len=0
  148  30.067919    10.0.2.15 → 130.85.36.80 TCP 74 51939 → 443 [SYN] Seq=0 Win=29200 Len=0 MSS=1460 SACK_PERM=1 TSval=2350243036 TSecr=0 WS=128
  149  30.068484 130.85.36.80 → 10.0.2.15    TCP 60 443 → 51939 [SYN, ACK] Seq=0 Ack=1 Win=65535 Len=0 MSS=1460
  150  30.068507    10.0.2.15 → 130.85.36.80 TCP 54 51939 → 443 [ACK] Seq=1 Ack=1 Win=29200 Len=0
  151  30.072188 130.85.36.80 → 10.0.2.15    TLSv1.2 1502 Certificate [TCP segment of a reassembled PDU]
  152  30.072205    10.0.2.15 → 130.85.36.80 TCP 54 46509 → 443 [ACK] Seq=191 Ack=5545 Win=39760 Len=0
  153  30.072311 130.85.36.80 → 10.0.2.15    TLSv1.2 397 Server Key Exchange, Server Hello Done
  154  30.072319    10.0.2.15 → 130.85.36.80 TCP 54 46509 → 443 [ACK] Seq=191 Ack=5888 Win=42600 Len=0
  155  30.073608 130.85.36.80 → 10.0.2.15    TLSv1.2 1502 Certificate [TCP segment of a reassembled PDU]
  156  30.073623    10.0.2.15 → 130.85.36.80 TCP 54 45811 → 443 [ACK] Seq=191 Ack=5545 Win=39760 Len=0
  157  30.073766 130.85.36.80 → 10.0.2.15    TLSv1.2 397 Server Key Exchange, Server Hello Done
  158  30.073774    10.0.2.15 → 130.85.36.80 TCP 54 45811 → 443 [ACK] Seq=191 Ack=5888 Win=42600 Len=0
  159  30.089656    10.0.2.15 → 130.85.36.80 TLSv1.2 180 Client Key Exchange, Change Cipher Spec, Finished
  160  30.089946 130.85.36.80 → 10.0.2.15    TCP 60 443 → 45811 [ACK] Seq=5888 Ack=317 Win=65535 Len=0
  161  30.091221 130.85.36.80 → 10.0.2.15    TLSv1.2 328 New Session Ticket, Change Cipher Spec, Finished
  162  30.094395    10.0.2.15 → 130.85.36.80 TLSv1.2 180 Client Key Exchange, Change Cipher Spec, Finished
  163  30.094667 130.85.36.80 → 10.0.2.15    TCP 60 443 → 46509 [ACK] Seq=5888 Ack=317 Win=65535 Len=0
  164  30.094859    10.0.2.15 → 130.85.36.80 TLSv1.2 180 Client Key Exchange, Change Cipher Spec, Finished
  165  30.095076 130.85.36.80 → 10.0.2.15    TCP 60 443 → 50533 [ACK] Seq=5888 Ack=317 Win=65535 Len=0
  166  30.095580 130.85.36.80 → 10.0.2.15    TLSv1.2 328 New Session Ticket, Change Cipher Spec, Finished
  167  30.096403 130.85.36.80 → 10.0.2.15    TLSv1.2 328 New Session Ticket, Change Cipher Spec, Finished
  168  30.096413    10.0.2.15 → 130.85.36.80 TCP 54 50533 → 443 [ACK] Seq=317 Ack=6162 Win=45440 Len=0
  169  30.137782    10.0.2.15 → 130.85.36.80 TCP 54 45811 → 443 [ACK] Seq=317 Ack=6162 Win=45440 Len=0
  170  30.144750    10.0.2.15 → 130.85.36.80 TCP 54 46509 → 443 [ACK] Seq=317 Ack=6162 Win=45440 Len=0
  171  30.185009    10.0.2.15 → 130.85.36.80 TLSv1 244 Client Hello
  172  30.185373 130.85.36.80 → 10.0.2.15    TCP 60 443 → 51939 [ACK] Seq=1 Ack=191 Win=65535 Len=0
  173  30.186086    10.0.2.15 → 130.85.36.80 TLSv1 244 Client Hello
  174  30.186392 130.85.36.80 → 10.0.2.15    TCP 60 443 → 40117 [ACK] Seq=1 Ack=191 Win=65535 Len=0
  175  30.186427 130.85.36.80 → 10.0.2.15    TLSv1.2 2894 Server Hello
  176  30.186435    10.0.2.15 → 130.85.36.80 TCP 54 51939 → 443 [ACK] Seq=191 Ack=2841 Win=34080 Len=0
  177  30.186620 130.85.36.80 → 10.0.2.15    TCP 1310 443 → 51939 [PSH, ACK] Seq=2841 Ack=191 Win=65535 Len=1256 [TCP segment of a reassembled PDU]
  178  30.186632    10.0.2.15 → 130.85.36.80 TCP 54 51939 → 443 [ACK] Seq=191 Ack=4097 Win=36920 Len=0
  179  30.187398 130.85.36.80 → 10.0.2.15    TLSv1.2 1502 Server Hello
  180  30.187407    10.0.2.15 → 130.85.36.80 TCP 54 40117 → 443 [ACK] Seq=191 Ack=1449 Win=31240 Len=0
  181  30.187462 130.85.36.80 → 10.0.2.15    TCP 1474 443 → 40117 [ACK] Seq=1449 Ack=191 Win=65535 Len=1420 [TCP segment of a reassembled PDU]
  182  30.187470    10.0.2.15 → 130.85.36.80 TCP 54 40117 → 443 [ACK] Seq=191 Ack=2869 Win=34080 Len=0
  183  30.187659 130.85.36.80 → 10.0.2.15    TCP 1282 443 → 40117 [PSH, ACK] Seq=2869 Ack=191 Win=65535 Len=1228 [TCP segment of a reassembled PDU]
  184  30.187667    10.0.2.15 → 130.85.36.80 TCP 54 40117 → 443 [ACK] Seq=191 Ack=4097 Win=36920 Len=0
  185  30.191928 130.85.36.80 → 10.0.2.15    TLSv1.2 1502 Certificate [TCP segment of a reassembled PDU]
  186  30.191937    10.0.2.15 → 130.85.36.80 TCP 54 51939 → 443 [ACK] Seq=191 Ack=5545 Win=39760 Len=0
  187  30.192103 130.85.36.80 → 10.0.2.15    TLSv1.2 397 Server Key Exchange, Server Hello Done
  188  30.192111    10.0.2.15 → 130.85.36.80 TCP 54 51939 → 443 [ACK] Seq=191 Ack=5888 Win=42600 Len=0
  189  30.193137 130.85.36.80 → 10.0.2.15    TLSv1.2 1502 Certificate [TCP segment of a reassembled PDU]
  190  30.193147    10.0.2.15 → 130.85.36.80 TCP 54 40117 → 443 [ACK] Seq=191 Ack=5545 Win=39760 Len=0
  191  30.193181 130.85.36.80 → 10.0.2.15    TLSv1.2 397 Server Key Exchange, Server Hello Done
  192  30.193187    10.0.2.15 → 130.85.36.80 TCP 54 40117 → 443 [ACK] Seq=191 Ack=5888 Win=42600 Len=0
  193  30.197866    10.0.2.15 → 130.85.36.80 TLSv1.2 180 Client Key Exchange, Change Cipher Spec, Finished
  194  30.198143 130.85.36.80 → 10.0.2.15    TCP 60 443 → 40117 [ACK] Seq=5888 Ack=317 Win=65535 Len=0
  195  30.199573 130.85.36.80 → 10.0.2.15    TLSv1.2 328 New Session Ticket, Change Cipher Spec, Finished
  196  30.205658    10.0.2.15 → 130.85.36.80 TLSv1.2 180 Client Key Exchange, Change Cipher Spec, Finished
  197  30.206017 130.85.36.80 → 10.0.2.15    TCP 60 443 → 51939 [ACK] Seq=5888 Ack=317 Win=65535 Len=0
  198  30.207022 130.85.36.80 → 10.0.2.15    TLSv1.2 328 New Session Ticket, Change Cipher Spec, Finished
  199  30.238657    10.0.2.15 → 130.85.36.80 HTTP 525 GET /wp-includes/js/jquery/jquery.js?ver=1.12.4 HTTP/1.1 
  200  30.239008 130.85.36.80 → 10.0.2.15    TCP 60 443 → 57929 [ACK] Seq=24443 Ack=2264 Win=65535 Len=0
  201  30.247800    10.0.2.15 → 130.85.36.80 TCP 54 40117 → 443 [ACK] Seq=317 Ack=6162 Win=45440 Len=0
  202  30.252804    10.0.2.15 → 130.85.36.80 TCP 54 51939 → 443 [ACK] Seq=317 Ack=6162 Win=45440 Len=0
  203  30.260145 130.85.36.80 → 10.0.2.15    TLSv1.2 8845 [SSL segment of a reassembled PDU]
  204  30.260162    10.0.2.15 → 130.85.36.80 TCP 54 57929 → 443 [ACK] Seq=2264 Ack=33234 Win=65320 Len=0
  205  30.260619 130.85.36.80 → 10.0.2.15    TCP 7294 [TCP segment of a reassembled PDU]
  206  30.260631    10.0.2.15 → 130.85.36.80 TCP 54 57929 → 443 [ACK] Seq=2264 Ack=40474 Win=65320 Len=0
  207  30.260665 130.85.36.80 → 10.0.2.15    TLSv1.2 939 [SSL segment of a reassembled PDU]
  208  30.260670    10.0.2.15 → 130.85.36.80 TCP 54 57929 → 443 [ACK] Seq=2264 Ack=41359 Win=65320 Len=0
  209  30.260976 130.85.36.80 → 10.0.2.15    TCP 1502 [TCP segment of a reassembled PDU]
  210  30.260986    10.0.2.15 → 130.85.36.80 TCP 54 57929 → 443 [ACK] Seq=2264 Ack=42807 Win=65320 Len=0
  211  30.261098 130.85.36.80 → 10.0.2.15    TLSv1.2 6731 [SSL segment of a reassembled PDU]
  212  30.261109    10.0.2.15 → 130.85.36.80 TCP 54 57929 → 443 [ACK] Seq=2264 Ack=49484 Win=65320 Len=0
  213  30.261490 130.85.36.80 → 10.0.2.15    TCP 1502 [TCP segment of a reassembled PDU]
  214  30.261499    10.0.2.15 → 130.85.36.80 TCP 54 57929 → 443 [ACK] Seq=2264 Ack=50932 Win=65320 Len=0
  215  30.261769 130.85.36.80 → 10.0.2.15    TLSv1.2 8161 [SSL segment of a reassembled PDU]HTTP/1.1 200 OK  (text/javascript)
  216  30.261782    10.0.2.15 → 130.85.36.80 TCP 54 57929 → 443 [ACK] Seq=2264 Ack=59039 Win=65320 Len=0
  217  30.343491    10.0.2.15 → 130.85.36.80 HTTP 551 GET /wp-content/themes/csee-responsive/style.css?ver=5.1.1 HTTP/1.1 
  218  30.343797    10.0.2.15 → 130.85.36.80 HTTP 604 GET /wp-content/themes/csee-responsive/res/dist/17dd2804f9093009184ba64d8e0d29442d6aadc9-dist.min.css?ver=5.1.1 HTTP/1.1 
  219  30.343875 130.85.36.80 → 10.0.2.15    TCP 60 443 → 45811 [ACK] Seq=6162 Ack=814 Win=65535 Len=0
  220  30.344065 130.85.36.80 → 10.0.2.15    TCP 60 443 → 50533 [ACK] Seq=6162 Ack=867 Win=65535 Len=0
  221  30.348537 130.85.36.80 → 10.0.2.15    HTTP 957 HTTP/1.1 200 OK  (text/css)
  222  30.348548    10.0.2.15 → 130.85.36.80 TCP 54 45811 → 443 [ACK] Seq=814 Ack=7065 Win=48280 Len=0
  223  30.364035 130.85.36.80 → 10.0.2.15    TLSv1.2 7294 [SSL segment of a reassembled PDU]
  224  30.364051    10.0.2.15 → 130.85.36.80 TCP 54 50533 → 443 [ACK] Seq=867 Ack=13402 Win=59640 Len=0
  225  30.364217 130.85.36.80 → 10.0.2.15    TLSv1.2 1599 [SSL segment of a reassembled PDU]
  226  30.364229    10.0.2.15 → 130.85.36.80 TCP 54 50533 → 443 [ACK] Seq=867 Ack=14947 Win=63900 Len=0
  227  30.364510 130.85.36.80 → 10.0.2.15    TLSv1.2 8179 [SSL segment of a reassembled PDU]
  228  30.364523    10.0.2.15 → 130.85.36.80 TCP 54 50533 → 443 [ACK] Seq=867 Ack=23072 Win=65320 Len=0
  229  30.364965 130.85.36.80 → 10.0.2.15    TCP 4398 [TCP segment of a reassembled PDU]
  230  30.364977    10.0.2.15 → 130.85.36.80 TCP 54 50533 → 443 [ACK] Seq=867 Ack=27416 Win=65320 Len=0
  231  30.365021 130.85.36.80 → 10.0.2.15    TLSv1.2 3835 [SSL segment of a reassembled PDU]
  232  30.365028    10.0.2.15 → 130.85.36.80 TCP 54 50533 → 443 [ACK] Seq=867 Ack=31197 Win=65320 Len=0
  233  30.365298 130.85.36.80 → 10.0.2.15    TCP 4398 [TCP segment of a reassembled PDU]
  234  30.365310    10.0.2.15 → 130.85.36.80 TCP 54 50533 → 443 [ACK] Seq=867 Ack=35541 Win=65320 Len=0
  235  30.365488 130.85.36.80 → 10.0.2.15    TLSv1.2 2354 [SSL segment of a reassembled PDU]HTTP/1.1 200 OK  (text/css)
  236  30.365498    10.0.2.15 → 130.85.36.80 TCP 54 50533 → 443 [ACK] Seq=867 Ack=37841 Win=65320 Len=0
  237  30.368367    10.0.2.15 → 130.85.36.80 HTTP 565 GET /wp-content/plugins/contact-form-7/includes/css/styles.css?ver=5.1.1 HTTP/1.1 
  238  30.368609 130.85.36.80 → 10.0.2.15    TCP 60 443 → 46509 [ACK] Seq=6162 Ack=828 Win=65535 Len=0
  239  30.371886 130.85.36.80 → 10.0.2.15    HTTP 1380 HTTP/1.1 200 OK  (text/css)
  240  30.371895    10.0.2.15 → 130.85.36.80 TCP 54 46509 → 443 [ACK] Seq=828 Ack=7488 Win=48280 Len=0
  241  30.428081    10.0.2.15 → 130.85.36.80 HTTP 580 GET /wp-content/plugins/master-slider/public/assets/css/masterslider.main.css?ver=3.5.3 HTTP/1.1 
  242  30.428406 130.85.36.80 → 10.0.2.15    TCP 60 443 → 40117 [ACK] Seq=6162 Ack=843 Win=65535 Len=0
  243  30.435310    10.0.2.15 → 130.85.36.80 HTTP 558 GET /wp-content/themes/csee-responsive/res/dist/nav.php?ver=5.1.1 HTTP/1.1 
  244  30.435564 130.85.36.80 → 10.0.2.15    TCP 60 443 → 51939 [ACK] Seq=6162 Ack=821 Win=65535 Len=0
  245  30.436462 130.85.36.80 → 10.0.2.15    TLSv1.2 7294 [SSL segment of a reassembled PDU]
  246  30.436480    10.0.2.15 → 130.85.36.80 TCP 54 40117 → 443 [ACK] Seq=843 Ack=13402 Win=59640 Len=0
  247  30.436625 130.85.36.80 → 10.0.2.15    TLSv1.2 1751 [SSL segment of a reassembled PDU]HTTP/1.1 200 OK  (text/css)
  248  30.436637    10.0.2.15 → 130.85.36.80 TCP 54 40117 → 443 [ACK] Seq=843 Ack=15099 Win=63900 Len=0
  249  30.517857    10.0.2.15 → 130.85.36.80 HTTP 536 GET /wp-includes/js/jquery/jquery-migrate.min.js?ver=1.4.1 HTTP/1.1 
  250  30.518196 130.85.36.80 → 10.0.2.15    TCP 60 443 → 57929 [ACK] Seq=59039 Ack=2746 Win=65535 Len=0
  251  30.522513 130.85.36.80 → 10.0.2.15    HTTP 4780 HTTP/1.1 200 OK  (text/javascript)
  252  30.522527    10.0.2.15 → 130.85.36.80 TCP 54 57929 → 443 [ACK] Seq=2746 Ack=63765 Win=65320 Len=0
  253  30.625100    10.0.2.15 → 130.85.36.80 HTTP 549 GET /wp-content/plugins/contact-form-7/includes/js/scripts.js?ver=5.1.1 HTTP/1.1 
  254  30.625468 130.85.36.80 → 10.0.2.15    TCP 60 443 → 46509 [ACK] Seq=7488 Ack=1323 Win=65535 Len=0
  255  30.625619    10.0.2.15 → 130.85.36.80 HTTP 588 GET /wp-content/themes/csee-responsive/res/dist/0ca4e7850399dfde4f274dbad1aa8e3a635439dc-dist.min.js?ver=5.1.1 HTTP/1.1 
  256  30.625835 130.85.36.80 → 10.0.2.15    TCP 60 443 → 45811 [ACK] Seq=7065 Ack=1348 Win=65535 Len=0
  257  30.627819    10.0.2.15 → 130.85.36.80 HTTP 523 GET /wp-includes/js/wp-embed.min.js?ver=5.1.1 HTTP/1.1 
  258  30.628034 130.85.36.80 → 10.0.2.15    TCP 60 443 → 50533 [ACK] Seq=37841 Ack=1336 Win=65535 Len=0
  259  30.630322 130.85.36.80 → 10.0.2.15    HTTP 4759 HTTP/1.1 200 OK  (text/javascript)
  260  30.630339    10.0.2.15 → 130.85.36.80 TCP 54 46509 → 443 [ACK] Seq=1323 Ack=12193 Win=58220 Len=0
  261  30.631163 130.85.36.80 → 10.0.2.15    HTTP 1488 HTTP/1.1 200 OK  (text/javascript)
  262  30.631172    10.0.2.15 → 130.85.36.80 TCP 54 50533 → 443 [ACK] Seq=1336 Ack=39275 Win=65320 Len=0
  263  30.631513    10.0.2.15 → 10.0.2.3     DNS 98 Standard query 0x239b A safebrowsing.googleapis.com OPT
  264  30.639927    10.0.2.15 → 10.0.2.3     DNS 98 Standard query 0xffe8 AAAA safebrowsing.googleapis.com OPT
  265  30.640269    10.0.2.15 → 10.0.2.3     DNS 104 Standard query 0x22da AAAA www-google-analytics.l.google.com OPT
  266  30.644192     10.0.2.3 → 10.0.2.15    DNS 369 Standard query response 0x239b A safebrowsing.googleapis.com A 172.217.5.234 NS ns1.google.com NS ns3.google.com NS ns4.google.com NS ns2.google.com A 216.239.34.10 AAAA 2001:4860:4802:34::a A 216.239.36.10 AAAA 2001:4860:4802:36::a A 216.239.38.10 AAAA 2001:4860:4802:38::a A 216.239.32.10 AAAA 2001:4860:4802:32::a OPT
  267  30.650901 130.85.36.80 → 10.0.2.15    TLSv1.2 1502 [SSL segment of a reassembled PDU]
  268  30.650920    10.0.2.15 → 130.85.36.80 TCP 54 45811 → 443 [ACK] Seq=1348 Ack=8513 Win=51120 Len=0
  269  30.651062 130.85.36.80 → 10.0.2.15    TLSv1.2 7397 [SSL segment of a reassembled PDU]
  270  30.651077    10.0.2.15 → 130.85.36.80 TCP 54 45811 → 443 [ACK] Seq=1348 Ack=15856 Win=65320 Len=0
  271  30.651428 130.85.36.80 → 10.0.2.15    TCP 1502 [TCP segment of a reassembled PDU]
  272  30.651439    10.0.2.15 → 130.85.36.80 TCP 54 45811 → 443 [ACK] Seq=1348 Ack=17304 Win=65320 Len=0
  273  30.651487 130.85.36.80 → 10.0.2.15    TCP 4314 443 → 45811 [ACK] Seq=17304 Ack=1348 Win=65535 Len=4260 [TCP segment of a reassembled PDU]
  274  30.651495    10.0.2.15 → 130.85.36.80 TCP 54 45811 → 443 [ACK] Seq=1348 Ack=21564 Win=65320 Len=0
  275  30.652019 130.85.36.80 → 10.0.2.15    TLSv1.2 2471 [SSL segment of a reassembled PDU]
  276  30.652029    10.0.2.15 → 130.85.36.80 TCP 54 45811 → 443 [ACK] Seq=1348 Ack=23981 Win=65320 Len=0
  277  30.652066 130.85.36.80 → 10.0.2.15    TLSv1.2 8179 [SSL segment of a reassembled PDU]
  278  30.652076    10.0.2.15 → 130.85.36.80 TCP 54 45811 → 443 [ACK] Seq=1348 Ack=32106 Win=65320 Len=0
  279  30.652445     10.0.2.3 → 10.0.2.15    DNS 381 Standard query response 0xffe8 AAAA safebrowsing.googleapis.com AAAA 2607:f8b0:4004:804::200a NS ns4.google.com NS ns1.google.com NS ns2.google.com NS ns3.google.com A 216.239.34.10 AAAA 2001:4860:4802:34::a A 216.239.36.10 AAAA 2001:4860:4802:36::a A 216.239.38.10 AAAA 2001:4860:4802:38::a A 216.239.32.10 AAAA 2001:4860:4802:32::a OPT
  280  30.652466 130.85.36.80 → 10.0.2.15    TLSv1.2 8179 [SSL segment of a reassembled PDU]
  281  30.652476    10.0.2.15 → 130.85.36.80 TCP 54 45811 → 443 [ACK] Seq=1348 Ack=40231 Win=65320 Len=0
  282  30.652515     10.0.2.3 → 10.0.2.15    DNS 380 Standard query response 0x22da AAAA www-google-analytics.l.google.com AAAA 2607:f8b0:4004:815::200e NS ns3.google.com NS ns4.google.com NS ns1.google.com NS ns2.google.com A 216.239.34.10 AAAA 2001:4860:4802:34::a A 216.239.32.10 AAAA 2001:4860:4802:32::a A 216.239.36.10 AAAA 2001:4860:4802:36::a A 216.239.38.10 AAAA 2001:4860:4802:38::a OPT
  283  30.652763 130.85.36.80 → 10.0.2.15    TCP 1502 [TCP segment of a reassembled PDU]
  284  30.652772    10.0.2.15 → 130.85.36.80 TCP 54 45811 → 443 [ACK] Seq=1348 Ack=41679 Win=65320 Len=0
  285  30.652830 130.85.36.80 → 10.0.2.15    TLSv1.2 6731 [SSL segment of a reassembled PDU]
  286  30.652839    10.0.2.15 → 130.85.36.80 TCP 54 45811 → 443 [ACK] Seq=1348 Ack=48356 Win=65320 Len=0
  287  30.653416 130.85.36.80 → 10.0.2.15    TLSv1.2 12346 [SSL segment of a reassembled PDU]
  288  30.653430    10.0.2.15 → 130.85.36.80 TCP 54 45811 → 443 [ACK] Seq=1348 Ack=60648 Win=65320 Len=0
  289  30.653464 130.85.36.80 → 10.0.2.15    HTTP 91 HTTP/1.1 200 OK  (text/javascript)
  290  30.653469    10.0.2.15 → 130.85.36.80 TCP 54 45811 → 443 [ACK] Seq=1348 Ack=60685 Win=65320 Len=0
  291  30.666937    10.0.2.15 → 172.217.5.234 TCP 74 59031 → 443 [SYN] Seq=0 Win=29200 Len=0 MSS=1460 SACK_PERM=1 TSval=454600593 TSecr=0 WS=128
  292  30.667139    10.0.2.15 → 172.217.164.174 TCP 74 37235 → 443 [SYN] Seq=0 Win=29200 Len=0 MSS=1460 SACK_PERM=1 TSval=1475921343 TSecr=0 WS=128
  293  30.667406    10.0.2.15 → 130.85.36.80 HTTP 563 GET /wp-content/plugins/master-slider/public/assets/js/jquery.easing.min.js?ver=3.5.3 HTTP/1.1 
  294  30.668760 130.85.36.80 → 10.0.2.15    TCP 60 443 → 40117 [ACK] Seq=15099 Ack=1352 Win=65535 Len=0
  295  30.671147 172.217.5.234 → 10.0.2.15    TCP 60 443 → 59031 [SYN, ACK] Seq=0 Ack=1 Win=65535 Len=0 MSS=1460
  296  30.671168    10.0.2.15 → 172.217.5.234 TCP 54 59031 → 443 [ACK] Seq=1 Ack=1 Win=29200 Len=0
  297  30.671214 130.85.36.80 → 10.0.2.15    HTTP 2596 HTTP/1.1 200 OK  (text/javascript)
  298  30.671221    10.0.2.15 → 130.85.36.80 TCP 54 40117 → 443 [ACK] Seq=1352 Ack=17641 Win=65320 Len=0
  299  30.671391 172.217.164.174 → 10.0.2.15    TCP 60 443 → 37235 [SYN, ACK] Seq=0 Ack=1 Win=65535 Len=0 MSS=1460
  300  30.671407    10.0.2.15 → 172.217.164.174 TCP 54 37235 → 443 [ACK] Seq=1 Ack=1 Win=29200 Len=0
  301  30.753855    10.0.2.15 → 172.217.5.234 TLSv1 254 Client Hello
  302  30.754228 172.217.5.234 → 10.0.2.15    TCP 60 443 → 59031 [ACK] Seq=1 Ack=201 Win=65535 Len=0
  303  30.754453    10.0.2.15 → 172.217.164.174 TLSv1 251 Client Hello
  304  30.754670 172.217.164.174 → 10.0.2.15    TCP 60 443 → 37235 [ACK] Seq=1 Ack=198 Win=65535 Len=0
  305  30.767106 172.217.5.234 → 10.0.2.15    TLSv1.2 2890 Server Hello
  306  30.767143    10.0.2.15 → 172.217.5.234 TCP 54 59031 → 443 [ACK] Seq=201 Ack=2837 Win=34080 Len=0
  307  30.767445 172.217.5.234 → 10.0.2.15    TLSv1.2 812 Certificate, Server Key Exchange, Server Hello Done
  308  30.767460    10.0.2.15 → 172.217.5.234 TCP 54 59031 → 443 [ACK] Seq=201 Ack=3595 Win=36920 Len=0
  309  30.769004 172.217.164.174 → 10.0.2.15    TLSv1.2 1472 Server Hello
  310  30.769015    10.0.2.15 → 172.217.164.174 TCP 54 37235 → 443 [ACK] Seq=198 Ack=1419 Win=31196 Len=0
  311  30.769050 172.217.164.174 → 10.0.2.15    TLSv1.2 1472 Certificate [TCP segment of a reassembled PDU]
  312  30.769057    10.0.2.15 → 172.217.164.174 TCP 54 37235 → 443 [ACK] Seq=198 Ack=2837 Win=34032 Len=0
  313  30.769311 172.217.164.174 → 10.0.2.15    TLSv1.2 107 Server Key Exchange, Server Hello Done
  314  30.769320    10.0.2.15 → 172.217.164.174 TCP 54 37235 → 443 [ACK] Seq=198 Ack=2890 Win=34032 Len=0
  315  30.777209    10.0.2.15 → 172.217.5.234 TLSv1.2 147 Client Key Exchange, Change Cipher Spec, Finished
  316  30.777504 172.217.5.234 → 10.0.2.15    TCP 60 443 → 59031 [ACK] Seq=3595 Ack=294 Win=65535 Len=0
  317  30.781494 172.217.5.234 → 10.0.2.15    TLSv1.2 338 New Session Ticket, Change Cipher Spec, Finished
  318  30.781503 172.217.5.234 → 10.0.2.15    HTTP2 123 SETTINGS[0], WINDOW_UPDATE[0]
  319  30.785331    10.0.2.15 → 172.217.164.174 TLSv1.2 147 Client Key Exchange, Change Cipher Spec, Finished
  320  30.785638 172.217.164.174 → 10.0.2.15    TCP 60 443 → 37235 [ACK] Seq=2890 Ack=291 Win=65535 Len=0
  321  30.789856 172.217.164.174 → 10.0.2.15    HTTP2 407 SETTINGS[0], WINDOW_UPDATE[0]
  322  30.827808    10.0.2.15 → 172.217.5.234 TCP 54 59031 → 443 [ACK] Seq=294 Ack=3948 Win=39760 Len=0
  323  30.837899    10.0.2.15 → 172.217.164.174 TCP 54 37235 → 443 [ACK] Seq=291 Ack=3243 Win=36868 Len=0
  324  30.850153    10.0.2.15 → 130.85.36.80 HTTP 562 GET /wp-content/plugins/master-slider/public/assets/js/masterslider.min.js?ver=3.5.3 HTTP/1.1 
  325  30.850499 130.85.36.80 → 10.0.2.15    TCP 60 443 → 57929 [ACK] Seq=63765 Ack=3254 Win=65535 Len=0
  326  30.863340 130.85.36.80 → 10.0.2.15    TLSv1.2 7294 [SSL segment of a reassembled PDU]
  327  30.863359    10.0.2.15 → 130.85.36.80 TCP 54 57929 → 443 [ACK] Seq=3254 Ack=71005 Win=65320 Len=0
  328  30.863483 130.85.36.80 → 10.0.2.15    TLSv1.2 1605 [SSL segment of a reassembled PDU]
  329  30.863490    10.0.2.15 → 130.85.36.80 TCP 54 57929 → 443 [ACK] Seq=3254 Ack=72556 Win=65320 Len=0
  330  30.863741 130.85.36.80 → 10.0.2.15    TCP 1502 [TCP segment of a reassembled PDU]
  331  30.863750    10.0.2.15 → 130.85.36.80 TCP 54 57929 → 443 [ACK] Seq=3254 Ack=74004 Win=65320 Len=0
  332  30.863794 130.85.36.80 → 10.0.2.15    TLSv1.2 6731 [SSL segment of a reassembled PDU]
  333  30.863802    10.0.2.15 → 130.85.36.80 TCP 54 57929 → 443 [ACK] Seq=3254 Ack=80681 Win=65320 Len=0
  334  30.864246 130.85.36.80 → 10.0.2.15    HTTP 5097 HTTP/1.1 200 OK  (text/javascript)
  335  30.864257    10.0.2.15 → 130.85.36.80 TCP 54 57929 → 443 [ACK] Seq=3254 Ack=85724 Win=65320 Len=0
  336  30.891362    10.0.2.15 → 172.217.164.174 HTTP2 158 Magic, SETTINGS[0]
  337  30.891731 172.217.164.174 → 10.0.2.15    TCP 60 443 → 37235 [ACK] Seq=3243 Ack=395 Win=65535 Len=0
  338  30.892314    10.0.2.15 → 172.217.164.174 HTTP2 110 SETTINGS[0]
  339  30.892521 172.217.164.174 → 10.0.2.15    TCP 60 443 → 37235 [ACK] Seq=3243 Ack=451 Win=65535 Len=0
  340  30.895460 172.217.164.174 → 10.0.2.15    HTTP2 92 SETTINGS[0]
  341  30.895469    10.0.2.15 → 172.217.164.174 TCP 54 37235 → 443 [ACK] Seq=451 Ack=3281 Win=36868 Len=0
  342  30.899423 172.217.164.174 → 10.0.2.15    HTTP2 92 SETTINGS[0]
  343  30.899432    10.0.2.15 → 172.217.164.174 TCP 54 37235 → 443 [ACK] Seq=451 Ack=3319 Win=36868 Len=0
  344  30.913896    10.0.2.15 → 172.217.164.174 HTTP2 92 SETTINGS[0]
  345  30.914233 172.217.164.174 → 10.0.2.15    TCP 60 443 → 37235 [ACK] Seq=3319 Ack=489 Win=65535 Len=0
  346  30.937048    10.0.2.15 → 130.85.36.80 HTTP 531 GET /wp-includes/js/wp-emoji-release.min.js?ver=5.1.1 HTTP/1.1 
  347  30.937381 130.85.36.80 → 10.0.2.15    TCP 60 443 → 50533 [ACK] Seq=39275 Ack=1813 Win=65535 Len=0
  348  30.942166 130.85.36.80 → 10.0.2.15    TLSv1.2 1502 [SSL segment of a reassembled PDU]
  349  30.942177    10.0.2.15 → 130.85.36.80 TCP 54 50533 → 443 [ACK] Seq=1813 Ack=40723 Win=65320 Len=0
  350  30.942230 130.85.36.80 → 10.0.2.15    TLSv1.2 3706 [SSL segment of a reassembled PDU]HTTP/1.1 200 OK  (text/javascript)
  351  30.942241    10.0.2.15 → 130.85.36.80 TCP 54 50533 → 443 [ACK] Seq=1813 Ack=44375 Win=65320 Len=0
  352  30.952816    10.0.2.15 → 172.217.5.234 HTTP2 158 Magic, SETTINGS[0]
  353  30.953078 172.217.5.234 → 10.0.2.15    TCP 60 443 → 59031 [ACK] Seq=3948 Ack=398 Win=65535 Len=0
  354  30.954100 130.85.36.80 → 10.0.2.15    HTTP 1136 HTTP/1.1 200 OK  (text/css)
  355  30.954115    10.0.2.15 → 130.85.36.80 TCP 54 51939 → 443 [ACK] Seq=821 Ack=7244 Win=48280 Len=0
  356  30.956765 172.217.5.234 → 10.0.2.15    HTTP2 92 SETTINGS[0]
  357  30.956776    10.0.2.15 → 172.217.5.234 TCP 54 59031 → 443 [ACK] Seq=398 Ack=3986 Win=39760 Len=0
  358  30.967480    10.0.2.15 → 130.85.36.80 HTTP 715 GET /wp-content/themes/csee-responsive/node_modules/smartmenus/dist/addons/bootstrap/jquery.smartmenus.bootstrap.css HTTP/1.1 
  359  30.967805 130.85.36.80 → 10.0.2.15    TCP 60 443 → 46509 [ACK] Seq=12193 Ack=1984 Win=65535 Len=0
  360  30.968476    10.0.2.15 → 172.217.5.234 HTTP2 110 SETTINGS[0]
  361  30.968693 172.217.5.234 → 10.0.2.15    TCP 60 443 → 59031 [ACK] Seq=3986 Ack=454 Win=65535 Len=0
  362  30.972556 172.217.5.234 → 10.0.2.15    HTTP2 92 SETTINGS[0]
  363  30.995543    10.0.2.15 → 172.217.5.234 HTTP2 92 SETTINGS[0]
  364  30.995925 172.217.5.234 → 10.0.2.15    TCP 60 443 → 59031 [ACK] Seq=4024 Ack=492 Win=65535 Len=0
  365  31.079204    10.0.2.15 → 172.217.164.174 HTTP2 322 HEADERS[1]: POST /r/collect
  366  31.079510 172.217.164.174 → 10.0.2.15    TCP 60 443 → 37235 [ACK] Seq=3319 Ack=757 Win=65535 Len=0
  367  31.079767    10.0.2.15 → 172.217.164.174 HTTP2 466 DATA[1]
  368  31.079976 172.217.164.174 → 10.0.2.15    TCP 60 443 → 37235 [ACK] Seq=3319 Ack=1169 Win=65535 Len=0
  369  31.080014    10.0.2.15 → 172.217.164.174 HTTP2 92 DATA[1] (text/plain)
  370  31.080162 172.217.164.174 → 10.0.2.15    TCP 60 443 → 37235 [ACK] Seq=3319 Ack=1207 Win=65535 Len=0
  371  31.094831 172.217.164.174 → 10.0.2.15    HTTP2 412 DATA[1] (GIF89a)
  372  31.094862 172.217.164.174 → 10.0.2.15    HTTP2 100 PING[0]
  373  31.103107    10.0.2.15 → 172.217.164.174 TCP 54 37235 → 443 [ACK] Seq=1207 Ack=3723 Win=39704 Len=0
  374  31.109076    10.0.2.15 → 172.217.164.174 HTTP2 100 PING[0]
